[
  {
    "from_id": "sn:catalog:application_access_request",
    "relationship": "uses",
    "to_id": "sn:variables:access_request_common",
    "confidence": "discovered",
    "evidence_locator": "mock://relation/1"
  },
  {
    "from_id": "sn:catalog:application_access_request",
    "relationship": "triggers",
    "to_id": "sn:flow:software_access_fulfillment",
    "confidence": "discovered",
    "evidence_locator": "mock://relation/2"
  },
  {
    "from_id": "sn:flow:software_access_fulfillment",
    "relationship": "invokes",
    "to_id": "sn:integration:identity_orchestrator",
    "confidence": "discovered",
    "evidence_locator": "mock://relation/3"
  },
  {
    "from_id": "sn:atf:application_access",
    "relationship": "covers",
    "to_id": "sn:catalog:application_access_request",
    "confidence": "discovered",
    "evidence_locator": "mock://relation/4"
  },
  {
    "from_id": "doc:standard:catalog_reuse",
    "relationship": "governs",
    "to_id": "sn:catalog:application_access_request",
    "confidence": "inferred",
    "evidence_locator": "mock://docs/catalog-reuse-standard"
  }
]